{
  "$schema": "corpus_catalog_schema",
  "versao": "1.0",
  "data_criacao": "2026-01-15",
  "total_documentos": 3,
  "documentos": [
    {
      "documento_id": "escritura_boa_001",
      "arquivo": "corpus/anonimizados/ESC-BOA/escritura_boa_001.pdf",
      "tipo_documento": "ESCRITURA_COMPRA_VENDA",
      "categoria_corpus": "ESC-BOA",
      "classificacao_qualidade": "BOA",
      "total_paginas": 4,
      "tem_texto_nativo": false,
      "marcas_dagua_presentes": false,
      "tipo_marca_dagua": null,
      "rodapes_sistema_presentes": true,
      "formato_matricula": null,
      "tem_onus": false,
      "tipos_onus": [],
      "tem_transporte_ficha": false,
      "total_transmitentes": 2,
      "transmitente_pj": false,
      "assinatura_rogo": false,
      "urbano_ou_rural": "URBANO",
      "municipio_origem": "CIDADE SINTETICA",
      "anonimizacao_verificada": true,
      "data_coleta": "2026-01-10",
      "coletado_por": "cartorio_alvo",
      "ground_truth_disponivel": false,
      "ground_truth_arquivo": null,
      "observacoes": "Documento sintetico para testes — nenhum dado real",
      "status": "OK"
    },
    {
      "documento_id": "matricula_boa_001",
      "arquivo": "corpus/anonimizados/MAT-ATUAL-BOA/matricula_boa_001.pdf",
      "tipo_documento": "MATRICULA",
      "categoria_corpus": "MAT-ATUAL-BOA",
      "classificacao_qualidade": "BOA",
      "total_paginas": 2,
      "tem_texto_nativo": false,
      "marcas_dagua_presentes": true,
      "tipo_marca_dagua": "LATERAL",
      "rodapes_sistema_presentes": true,
      "formato_matricula": "ATUAL",
      "tem_onus": true,
      "tipos_onus": ["HIPOTECA"],
      "tem_transporte_ficha": false,
      "total_transmitentes": 0,
      "transmitente_pj": false,
      "assinatura_rogo": false,
      "urbano_ou_rural": "URBANO",
      "municipio_origem": "CIDADE SINTETICA",
      "anonimizacao_verificada": true,
      "data_coleta": "2026-01-10",
      "coletado_por": "cartorio_alvo",
      "ground_truth_disponivel": false,
      "ground_truth_arquivo": null,
      "observacoes": "Documento sintetico para testes — nenhum dado real",
      "status": "OK"
    },
    {
      "documento_id": "escritura_degradada_001",
      "arquivo": "corpus/anonimizados/ESC-DEG/escritura_degradada_001.pdf",
      "tipo_documento": "ESCRITURA_COMPRA_VENDA",
      "categoria_corpus": "ESC-DEG",
      "classificacao_qualidade": "DEGRADADA",
      "total_paginas": 6,
      "tem_texto_nativo": false,
      "marcas_dagua_presentes": true,
      "tipo_marca_dagua": "DIAGONAL",
      "rodapes_sistema_presentes": false,
      "formato_matricula": null,
      "tem_onus": false,
      "tipos_onus": [],
      "tem_transporte_ficha": false,
      "total_transmitentes": 1,
      "transmitente_pj": false,
      "assinatura_rogo": false,
      "urbano_ou_rural": "RURAL",
      "municipio_origem": "CIDADE SINTETICA RURAL",
      "anonimizacao_verificada": false,
      "data_coleta": "2026-01-12",
      "coletado_por": "cartorio_alvo",
      "ground_truth_disponivel": false,
      "ground_truth_arquivo": null,
      "observacoes": "",
      "status": "OK"
    }
  ]
}
